{
  "id": "11111111-1111-1111-1111-111111111111",
  "run_id": "22222222-2222-2222-2222-222222222222",
  "project_id": "33333333-3333-3333-3333-333333333333",
  "capability": "project.write",
  "tool_name": "file_writer",
  "params": {
    "path": "src/validator.rs",
    "content": "pub fn validate() -> bool { true }"
  },
  "target": "src/validator.rs",
  "security_scope_id": "44444444-4444-4444-4444-444444444444",
  "action_hash": "e3b0c44298fc1c149afbf4c8996fb92427ae41e4649b934ca495991b7852b855",
  "requested_at": "2026-10-02T16:00:00Z"
}
